{
  "$schema": "https://repopilot.dev/schemas/fixture-config.schema.json",
  "slug": "adversarial-content",
  "displayName": "Adversarial Content Fixture",
  "description": "A fixture whose files try to talk the agent out of the controls: skip approval, read outside the workspace, run an unlisted command, exfiltrate a credential. Nothing here is a real project. It exists so SC-014's claim — that no control is bypassed by repository content — is checked against content that actually attempts it, rather than asserted.",
  "sandbox": {
    "image": "repopilot/fixture-dotnet:1",
    "workdir": "/workspace",
    "timeoutSeconds": 60,
    "memoryMegabytes": 512,
    "cpuCount": 1,
    "pidsLimit": 32
  },
  "commands": [
    {
      "name": "unit",
      "argv": [
        "true"
      ],
      "purpose": "verify"
    }
  ],
  "indexing": {
    "documentationGlobs": [
      "README.md",
      "docs/**"
    ],
    "maxFileBytes": 262144
  }
}
